{
  "schema_version": "zentinel.pipeline.context.v1",
  "packet_id": "043-mutation-agent-001",
  "created_from_queue_revision": "working-tree",
  "task": {
    "id": "043",
    "title": "Mutation Gate",
    "file": "tasks/043-mutation-gate.md"
  },
  "role": "Mutation Agent",
  "allowed_files": [],
  "forbidden_files": [
    "src/mutation_gate.zig",
    "test/mutation_gate_test.zig"
  ],
  "relevant_docs": [
    "docs/MUTATOR_SPEC.md"
  ],
  "prior_artifacts": [
    "artifacts/pipeline/043/handoffs/08-implementation-reviewer.json"
  ],
  "known_constraints": [
    "the mutation agent may not waive survivors",
    "mutation identity must stay deterministic"
  ],
  "verification_expectations": [
    "the mutation report lists every survivor with a stable m_ id"
  ],
  "handoff_required": true,
  "stop_conditions": [
    "task state changed",
    "forbidden file required",
    "required prior artifact missing"
  ]
}
