{
  "schema_version": "zentinel.pipeline.context.v1",
  "packet_id": "043-doctest-agent-001",
  "created_from_queue_revision": "working-tree",
  "task": {
    "id": "043",
    "title": "Mutation Gate",
    "file": "tasks/043-mutation-gate.md"
  },
  "role": "Doctest Agent",
  "allowed_files": [],
  "forbidden_files": [
    "src/mutation_gate.zig"
  ],
  "relevant_docs": [
    "docs/DOCTEST_AI_INTEGRATION.md"
  ],
  "prior_artifacts": [
    "artifacts/pipeline/043/handoffs/08-implementation-reviewer.json"
  ],
  "known_constraints": [
    "expected output may not change without semantic review",
    "doctest snapshots are byte-exact"
  ],
  "verification_expectations": [
    "zentinel doctest reports every changed block as passing"
  ],
  "handoff_required": true,
  "stop_conditions": [
    "task state changed",
    "snapshot semantic review required"
  ]
}
