{
  "schema_version": "zentinel.pipeline.context.v1",
  "packet_id": "043-verifier-001",
  "created_from_queue_revision": "working-tree",
  "task": {
    "id": "043",
    "title": "Mutation Gate",
    "file": "tasks/043-mutation-gate.md"
  },
  "role": "Verifier",
  "allowed_files": [],
  "forbidden_files": [
    "src/mutation_gate.zig",
    "test/mutation_gate_test.zig"
  ],
  "relevant_docs": [
    "tasks/043-mutation-gate.md",
    "docs/ORCHESTRATION_SPEC.md",
    "docs/HANDOFF_CONTRACTS.md"
  ],
  "prior_artifacts": [
    "artifacts/pipeline/043/handoffs/05-test-author.json",
    "artifacts/pipeline/043/handoffs/06-test-reviewer.json",
    "artifacts/pipeline/043/handoffs/07-implementer.json",
    "artifacts/pipeline/043/handoffs/08-implementation-reviewer.json",
    "artifacts/pipeline/043/handoffs/09-mutation-agent.json"
  ],
  "known_constraints": [
    "no code may be patched during final verification",
    "skipped stages must record a reason instead of a fake passing handoff"
  ],
  "verification_expectations": [
    "zig build test passes",
    "zig build succeeds",
    "zig fmt --check src test build.zig is clean",
    "python3 scripts/validate_task_system.py passes"
  ],
  "handoff_required": true,
  "stop_conditions": [
    "task state changed",
    "code patch required"
  ]
}
