{
  "schema_version": "zentinel.pipeline.context.v1",
  "packet_id": "123-orchestrator-2026-06-01",
  "created_from_queue_revision": "b161a274b2ec8fbb7ba62736b97fa95e0239b6b8",
  "task": {
    "id": "123",
    "title": "Resolve Follow-Up Audit Findings",
    "file": "tasks/123-resolve-follow-up-audit-findings.md"
  },
  "role": "Orchestrator",
  "allowed_files": [
    "src/config.zig",
    "src/root.zig",
    "src/cli.zig",
    "src/command.zig",
    "src/test_selection.zig",
    "src/run_command.zig",
    "src/ast_backend.zig",
    "src/mutant.zig",
    "src/mutant_runner.zig",
    "src/runner.zig",
    "src/ai/command.zig",
    "src/ai/context.zig",
    "src/ai/doctest_command.zig",
    "src/ai/redaction.zig",
    "src/doctest/report.zig",
    "src/doctest/workspace.zig",
    "schemas/doctest.report.v1.schema.json",
    "docs/CLI_SPEC.md",
    "docs/DOCTEST_SPEC.md",
    "docs/DOCTEST_AI_INTEGRATION.md",
    "docs/FAILURE_MODES.md",
    "docs/REPORT_FORMAT.md",
    "docs/SANDBOX_SECURITY.md",
    "docs/TEST_SELECTION.md",
    "docs/ZIG_VERSION_POLICY.md",
    "test/ai_command_test.zig",
    "test/ai_doctest_test.zig",
    "test/ai_doctest_cli_test.zig",
    "test/ai_doctest_survivor_cli_test.zig",
    "test/ast_candidate_ordering_test.zig",
    "test/cli_test.zig",
    "test/config_test.zig",
    "test/doctest_cli_command_test.zig",
    "test/doctest_mutate_stabilization_test.zig",
    "test/doctest_mutation_experiment_test.zig",
    "test/doctest_runner_test.zig",
    "test/list_mutants_command_test.zig",
    "test/mutant_runner_test.zig",
    "test/report_renderers_test.zig",
    "test/report_schema_test.zig",
    "test/run_command_test.zig",
    "test/sandbox_test.zig",
    "test/test_selection_test.zig",
    "test/zig_version_test.zig",
    "artifacts/pipeline/123/**",
    "tasks/123-resolve-follow-up-audit-findings.md",
    "tasks/STATUS.md",
    "tasks/status.json"
  ],
  "forbidden_files": [
    "build.zig",
    "build.zig.zon",
    ".claude/**"
  ],
  "relevant_docs": [
    "docs/TDD_POLICY.md",
    "docs/ARCHITECTURE.md",
    "docs/INVARIANTS.md",
    "docs/DISCIPLINE.md",
    "docs/STYLE.md",
    "docs/CLI_SPEC.md",
    "docs/DOCTEST_SPEC.md",
    "docs/DOCTEST_AI_INTEGRATION.md",
    "docs/FAILURE_MODES.md",
    "docs/SANDBOX_SECURITY.md",
    "docs/REPORT_FORMAT.md",
    "docs/TEST_SELECTION.md",
    "docs/ZIG_VERSION_POLICY.md"
  ],
  "prior_artifacts": [
    "CLAUDE_ASSESMENT_OF_CODEX_FINDINGS.md",
    "CODEX_FINDINGS.md",
    "CODEX_FINDINGS_FOLLOWUP_1.md",
    "CODEX_FINDINGS_FOLLOWUP_2.md",
    "CODEX_FINDINGS_FOLLOWUP_3.md",
    "artifacts/pipeline/122/verification/report.json"
  ],
  "known_constraints": [
    "Write failing tests before implementation.",
    "Modify only allowed files plus task-control and task-scoped pipeline artifacts.",
    "Preserve deterministic core behavior and AST as the stable default backend.",
    "Support only pinned Zig 0.16.0.",
    "AI remains advisory and never determines correctness."
  ],
  "verification_expectations": [
    "Targeted tests for each changed module pass.",
    "zig build test and zig build pass.",
    "zig fmt --check src test and git diff --check pass.",
    "python3 scripts/validate_task_system.py passes before completion."
  ],
  "handoff_required": true,
  "stop_conditions": [
    "A required fix would require modifying a forbidden file.",
    "A product-judgment decision is not determined by repository contracts."
  ]
}
