{
  "schema_version": "zentinel.pipeline.context.v1",
  "packet_id": "064-orchestrator-001",
  "created_from_queue_revision": "working-tree",
  "task": {
    "id": "064",
    "title": "Pipeline Artifact CI Integration",
    "file": "tasks/064-pipeline-artifact-ci-integration.md"
  },
  "role": "Orchestrator",
  "allowed_files": [],
  "forbidden_files": [],
  "relevant_docs": [],
  "prior_artifacts": [],
  "known_constraints": [],
  "verification_expectations": [],
  "handoff_required": true,
  "stop_conditions": [
    "task state changed"
  ]
}
