{
  "schema_version": "zentinel.pipeline.context.v1",
  "packet_id": "122-orchestrator-2026-06-01",
  "created_from_queue_revision": "f0db62bc36b4c49f9c395462601e543cef28706f",
  "task": {
    "id": "122",
    "title": "Close Remaining Audit Findings",
    "file": "tasks/122-close-remaining-audit-findings.md"
  },
  "role": "Orchestrator",
  "allowed_files": [
    "src/ast_backend.zig",
    "src/mutant.zig",
    "src/run_command.zig",
    "src/list_mutants_command.zig",
    "src/cli.zig",
    "src/runner.zig",
    "src/doctest/runner.zig",
    "src/report.zig",
    "src/cache.zig",
    "src/zig_version.zig",
    "src/ai/command.zig",
    "docs/REPORT_FORMAT.md",
    "docs/SANDBOX_SECURITY.md",
    "docs/AI_CONTEXT_SCHEMA.md",
    "docs/PERFORMANCE_STRATEGY.md",
    "docs/TEST_SELECTION.md",
    "test/ast_candidate_ordering_test.zig",
    "test/mutators/loop_boundary_test.zig",
    "test/run_command_test.zig",
    "test/list_mutants_command_test.zig",
    "test/runner_baseline_test.zig",
    "test/doctest_runner_test.zig",
    "test/report_determinism_test.zig",
    "test/cache_key_test.zig",
    "test/snapshots/cache_metadata.json",
    "test/zig_version_test.zig",
    "test/cli_test.zig",
    "test/ai_command_test.zig",
    "test/integration_run_test.zig",
    "test/sandbox_test.zig",
    "CLAUDE_ASSESMENT_OF_CODEX_FINDINGS.md",
    "CODEX_FINDINGS.md",
    "CODEX_FINDINGS_FOLLOWUP_1.md",
    "CODEX_FINDINGS_FOLLOWUP_2.md",
    "CODEX_FINDINGS_FOLLOWUP_3.md",
    "tasks/122-close-remaining-audit-findings.md",
    "tasks/STATUS.md",
    "tasks/status.json",
    "artifacts/pipeline/122/**"
  ],
  "forbidden_files": [
    "build.zig",
    "build.zig.zon",
    ".claude/**"
  ],
  "relevant_docs": [
    "docs/TDD_POLICY.md",
    "docs/ARCHITECTURE.md",
    "docs/INVARIANTS.md",
    "docs/DISCIPLINE.md",
    "docs/STYLE.md",
    "docs/MUTATOR_SPEC.md",
    "docs/ZIG_VERSION_POLICY.md",
    "docs/FAILURE_MODES.md",
    "docs/SANDBOX_SECURITY.md",
    "docs/REPORT_FORMAT.md",
    "docs/TEST_SELECTION.md"
  ],
  "prior_artifacts": [
    "CLAUDE_ASSESMENT_OF_CODEX_FINDINGS.md",
    "CODEX_FINDINGS.md",
    "CODEX_FINDINGS_FOLLOWUP_1.md",
    "CODEX_FINDINGS_FOLLOWUP_2.md",
    "CODEX_FINDINGS_FOLLOWUP_3.md"
  ],
  "known_constraints": [
    "Write failing tests before implementation.",
    "Modify only allowed files plus task-control and task-scoped pipeline artifacts.",
    "Preserve deterministic core behavior and AST as the stable default backend.",
    "Support only pinned Zig 0.16.0."
  ],
  "verification_expectations": [
    "Targeted tests for each changed module pass.",
    "Broader relevant test suite passes.",
    "python3 scripts/validate_task_system.py passes before completion."
  ],
  "handoff_required": false,
  "stop_conditions": [
    "A required fix would require modifying a forbidden file.",
    "A product-judgment decision is not determined by repository contracts."
  ]
}
