{
  "schema_version": "zentinel.pipeline.context.v1",
  "packet_id": "043-mutation-agent-001",
  "created_from_queue_revision": "working-tree",
  "task": {
    "id": "043",
    "title": "Mutation Gate",
    "file": "tasks/043-mutation-gate.md"
  },
  "role": "Mutation Agent",
  "allowed_files": [],
  "forbidden_files": [],
  "relevant_docs": [],
  "prior_artifacts": [],
  "known_constraints": [],
  "verification_expectations": [],
  "handoff_required": true,
  "stop_conditions": [
    "task state changed",
    "forbidden file required",
    "required prior artifact missing"
  ]
}
