{
  "schema_version": "zentinel.pipeline.context.v1",
  "packet_id": "047-orchestrator-001",
  "created_from_queue_revision": "working-tree",
  "task": {
    "id": "047",
    "title": "Sequential Task Locking",
    "file": "tasks/047-sequential-task-locking.md"
  },
  "role": "Orchestrator",
  "allowed_files": [
    "docs/SEQUENTIAL_EXECUTION_POLICY.md",
    "docs/TASK_LIFECYCLE.md",
    "docs/FAILURE_RECOVERY.md",
    "docs/ORCHESTRATION_SPEC.md",
    "docs/AGENT_GUIDE.md",
    "test/fixtures/pipeline/sequential_locking/**"
  ],
  "forbidden_files": [
    "src/**",
    "test/**/*.zig",
    "build.zig",
    "schemas/pipeline.active_lock.v1.schema.json"
  ],
  "relevant_docs": [
    "tasks/047-sequential-task-locking.md",
    "docs/SEQUENTIAL_EXECUTION_POLICY.md",
    "schemas/pipeline.active_lock.v1.schema.json"
  ],
  "prior_artifacts": [
    "artifacts/pipeline/046/verification/report.json"
  ],
  "known_constraints": [
    "only one task may be active across all task-control files",
    "the synchronized task-control files are authoritative over a stale lock",
    "do not reorder existing tasks or implement distributed locking"
  ],
  "verification_expectations": [
    "the sequential-lock checker rejects two active tasks, stale locks, MD/JSON mismatch, and skip-ahead",
    "python3 scripts/validate_task_system.py passes"
  ],
  "handoff_required": true,
  "stop_conditions": [
    "task state changed",
    "forbidden file required",
    "two active tasks detected"
  ]
}
