{
  "schema_version": "zentinel.pipeline.context.v1",
  "packet_id": "125-orchestrator-2026-06-01",
  "created_from_queue_revision": "b161a274b2ec8fbb7ba62736b97fa95e0239b6b8",
  "task": {
    "id": "125",
    "title": "Close Task 124 Audit Follow-Ups",
    "file": "tasks/125-close-task-124-audit-followups.md"
  },
  "role": "Orchestrator",
  "allowed_files": [
    "src/config.zig",
    "src/root.zig",
    "src/cli.zig",
    "src/command.zig",
    "src/test_selection.zig",
    "src/run_command.zig",
    "src/list_mutants_command.zig",
    "src/ast_backend.zig",
    "src/mutant.zig",
    "src/mutant_runner.zig",
    "src/runner.zig",
    "src/ai/command.zig",
    "src/ai/context.zig",
    "src/ai/doctest_command.zig",
    "src/ai/redaction.zig",
    "src/doctest/mutation_experiment.zig",
    "src/doctest/mutator_doctest.zig",
    "src/doctest/report.zig",
    "src/doctest/workspace.zig",
    "schemas/doctest.report.v1.schema.json",
    "schemas/ai.doctest.context.v1.schema.json",
    "docs/AI_CONTEXT_SCHEMA.md",
    "docs/CLI_SPEC.md",
    "docs/CONFIG_SPEC.md",
    "docs/DOCTEST_SPEC.md",
    "docs/DOCTEST_AI_INTEGRATION.md",
    "docs/FAILURE_MODES.md",
    "docs/REPORT_FORMAT.md",
    "docs/SANDBOX_SECURITY.md",
    "docs/TEST_SELECTION.md",
    "docs/ZIG_VERSION_POLICY.md",
    "test/ai_command_test.zig",
    "test/ai_doctest_test.zig",
    "test/ai_doctest_cli_test.zig",
    "test/ai_doctest_survivor_cli_test.zig",
    "test/ast_candidate_ordering_test.zig",
    "test/check_command_test.zig",
    "test/cli_test.zig",
    "test/config_test.zig",
    "test/doctest_cli_command_test.zig",
    "test/doctest_mutate_stabilization_test.zig",
    "test/doctest_mutation_experiment_test.zig",
    "test/doctest_mutator_spec_test.zig",
    "test/doctest_runner_test.zig",
    "test/integration_run_test.zig",
    "test/list_mutants_command_test.zig",
    "test/mutant_runner_test.zig",
    "test/report_renderers_test.zig",
    "test/report_schema_test.zig",
    "test/run_command_test.zig",
    "test/sandbox_test.zig",
    "test/test_selection_test.zig",
    "test/zig_version_test.zig",
    "test/fixtures/ai/doctest_survivor/report.json",
    "test/fixtures/doctest/mutation_stabilization/killed.stable.json",
    "test/fixtures/doctest/mutation_stabilization/survived.stable.json",
    "scripts/validate_task_system.py",
    "tests/coverage-gaps/failure_modes.v1.json",
    "tests/coverage-gaps/invariants.v1.json",
    "tests/coverage-gaps/schemas.v1.json",
    "artifacts/pipeline/123/**",
    "artifacts/pipeline/124/**",
    "artifacts/pipeline/125/**",
    "tasks/123-resolve-follow-up-audit-findings.md",
    "tasks/124-close-task-122-123-audit-regressions.md",
    "tasks/125-close-task-124-audit-followups.md",
    "tasks/STATUS.md",
    "tasks/status.json"
  ],
  "forbidden_files": [
    "build.zig",
    "build.zig.zon",
    ".claude/**"
  ],
  "relevant_docs": [
    "docs/TDD_POLICY.md",
    "docs/ARCHITECTURE.md",
    "docs/INVARIANTS.md",
    "docs/DISCIPLINE.md",
    "docs/STYLE.md",
    "docs/AI_CONTEXT_SCHEMA.md",
    "docs/CLI_SPEC.md",
    "docs/CONFIG_SPEC.md",
    "docs/DOCTEST_SPEC.md",
    "docs/DOCTEST_AI_INTEGRATION.md",
    "docs/FAILURE_MODES.md",
    "docs/SANDBOX_SECURITY.md",
    "docs/REPORT_FORMAT.md"
  ],
  "prior_artifacts": [
    "artifacts/pipeline/122/verification/report.json",
    "artifacts/pipeline/123/verification/report.json",
    "artifacts/pipeline/124/verification/report.json"
  ],
  "known_constraints": [
    "Write failing tests before implementation.",
    "Modify only allowed files plus task-control, row-scoped gap registries, and task-scoped pipeline artifacts.",
    "Preserve deterministic core behavior and AST as the stable default backend.",
    "Support only pinned Zig 0.16.0.",
    "AI remains advisory and never determines correctness."
  ],
  "verification_expectations": [
    "Targeted tests for changed modules pass.",
    "zig build test --summary all and zig build pass.",
    "zig fmt --check src test and git diff --check pass.",
    "python3 scripts/validate_task_system.py passes while active and after completion."
  ],
  "handoff_required": true,
  "stop_conditions": [
    "A required fix would require modifying a forbidden file.",
    "A product-judgment decision is not determined by repository contracts."
  ]
}
