{
  "schema_version": "zentinel.pipeline.context.v1",
  "packet_id": "043-test-author-001",
  "created_from_queue_revision": "working-tree",
  "task": {
    "id": "043",
    "title": "Mutation Gate",
    "file": "tasks/043-mutation-gate.md"
  },
  "role": "Test Author",
  "allowed_files": [
    "test/mutation_gate_test.zig"
  ],
  "forbidden_files": [
    "src/mutation_gate.zig",
    "src/root.zig"
  ],
  "relevant_docs": [
    "tasks/043-mutation-gate.md",
    "docs/ORCHESTRATION_SPEC.md",
    "docs/HANDOFF_CONTRACTS.md"
  ],
  "prior_artifacts": [],
  "known_constraints": [
    "write a failing test before any implementation exists",
    "deterministic core must not call AI",
    "do not assume production changes in the test plan"
  ],
  "verification_expectations": [
    "zig build test fails on the new mutation gate test before implementation"
  ],
  "handoff_required": true,
  "stop_conditions": [
    "task state changed",
    "forbidden file required"
  ]
}
