{
  "schema_version": "zentinel.pipeline.context.v1",
  "packet_id": "043-implementer-001",
  "created_from_queue_revision": "working-tree",
  "task": {
    "id": "043",
    "title": "Mutation Gate",
    "file": "tasks/043-mutation-gate.md"
  },
  "role": "Implementer",
  "allowed_files": [
    "src/mutation_gate.zig",
    "src/root.zig"
  ],
  "forbidden_files": [
    "test/mutation_gate_test.zig"
  ],
  "relevant_docs": [
    "tasks/043-mutation-gate.md",
    "docs/ORCHESTRATION_SPEC.md"
  ],
  "prior_artifacts": [
    "artifacts/pipeline/043/handoffs/05-test-author.json",
    "artifacts/pipeline/043/handoffs/06-test-reviewer.json"
  ],
  "known_constraints": [
    "implement the smallest change that makes the approved tests pass",
    "do not edit approved tests unless the task is returned to Test Author",
    "deterministic core must not call AI"
  ],
  "verification_expectations": [
    "zig build test passes",
    "zig build succeeds",
    "zig fmt --check src test build.zig is clean"
  ],
  "handoff_required": true,
  "stop_conditions": [
    "task state changed",
    "approved test change required",
    "required prior artifact missing"
  ]
}
