{
  "schema_version": "zentinel.pipeline.context.v1",
  "packet_id": "042-test-author-001",
  "created_from_queue_revision": "working-tree",
  "task": {
    "id": "042",
    "title": "Context Packet System",
    "file": "tasks/042-context-packet-system.md"
  },
  "role": "Test Author",
  "allowed_files": [
    "test/fixtures/pipeline/context_packet/**"
  ],
  "forbidden_files": [
    "src/**",
    "test/**/*.zig",
    "build.zig",
    "scripts/validate_task_system.py"
  ],
  "relevant_docs": [
    "tasks/042-context-packet-system.md",
    "docs/AGENT_CONTEXT_PACKETS.md",
    "schemas/pipeline.context.v1.schema.json",
    "schemas/pipeline.stale_context.v1.schema.json"
  ],
  "prior_artifacts": [
    "artifacts/pipeline/063/verification/report.json"
  ],
  "known_constraints": [
    "add a failing fixture for a packet missing task.id, role, or allowed_files before adding valid fixtures",
    "refine the baseline 041 schemas without adding required fields so the 063 metadata_validator context fixture still validates",
    "validation is by the project subset validator; jsonschema is not installed"
  ],
  "verification_expectations": [
    "subset_validate rejects context_packet/invalid/*.json before the valid fixtures exist",
    "python3 scripts/validate_task_system.py passes once fixtures and schema refinements land"
  ],
  "handoff_required": true,
  "stop_conditions": [
    "task state changed",
    "forbidden file required",
    "required prior artifact missing"
  ]
}
